{
  "$schema": "https://json-schema.org/draft/2020-12/schema",
  "title": "MintPack",
  "type": "object",
  "required": [
    "mint_pack_id",
    "asset_id",
    "token_standard_target",
    "network",
    "status"
  ],
  "properties": {
    "mint_pack_id": {
      "type": "string"
    },
    "asset_id": {
      "type": "string"
    },
    "project_id": {
      "type": "string"
    },
    "token_standard_target": {
      "type": "string"
    },
    "network": {
      "type": "string"
    },
    "metadata_path": {
      "type": "string"
    },
    "file_manifest_path": {
      "type": "string"
    },
    "status": {
      "type": "string"
    },
    "review_required": {
      "type": "boolean"
    },
    "notes": {
      "type": "string"
    }
  }
}
